{
  "id": "farai",
  "name": "FAR.AI",
  "type": "nonprofit",
  "hq": "Berkeley, US",
  "domains": [
    "jailbreak",
    "bio",
    "cyber",
    "misuse"
  ],
  "confidence": "high",
  "summary": "Red-teaming and adversarial-robustness nonprofit; leads the EU AI Office CBRN risk-modelling contract.",
  "what_would_move_the_score": "Disclose the AI Safety Fund share of budget and whether lab-funded pools are excluded from evaluation work."
}
