{
 "id": "big4",
 "name": "Assurance firms (Big Four and peers)",
 "type": "hypothetical",
 "hq": "Global",
 "domains": [
  "assurance"
 ],
 "confidence": "low",
 "summary": "Expected entrants once Illinois SB 315 audits begin in 2028; no frontier elicitation capability yet.",
 "what_would_move_the_score": "A frontier-AI audit practice with published methodology and a technical partner.",
 "role": "expected-entrant",
 "status": "watchlist"
}
